{
  "id": "evt_QACP04_success_20260709A",
  "object": "event",
  "type": "checkout.session.completed",
  "created": 1799600000,
  "livemode": false,
  "data": {
    "object": {
      "id": "cs_test_qacp04_success_001",
      "metadata": { "email": "qa_cp04_stripe_nomatch@invalid.test" }
    }
  }
}
